{
  "$schema": "./node_modules/@kompiro/adr-tools/dist/config.schema.json",
  "idFormat": "date-sequence",
  "topics": ["architecture", "infrastructure", "process"],
  "concerns": ["security", "performance", "ci"],
  "paths": {
    "adrDir": "docs/adr",
    "outputs": {
      "effective": "effective.md",
      "graph": "graph.md",
      "graphByTopic": "graph/"
    }
  }
}
